{
  "currency": "USD",
  "recordCount": 200,
  "sourceSystem": "commerce-cloud-v4",
  "schemaVersion": "orders.v4",
  "focusOrderDate": "2025-10-27",
  "focusOrderChannel": "store",
  "focusOrderStatus": "shipped",
  "focusOrderBuyerName": "Devon Marsh",
  "focusOrderBuyerTier": "silver",
  "focusOrderBuyerRegion": "WEST",
  "focusOrderShippingCarrier": "DHL",
  "focusOrderPaymentMethod": "paypal",
  "focusOrderLineItems": [
    {
      "sku": "SKU-SF-610",
      "title": "Halden 3-Seat Sofa",
      "category": "Seating",
      "quantity": 4,
      "unitPriceCents": 129900,
      "discountCents": 1500
    },
    {
      "sku": "SKU-SH-810",
      "title": "Atlas Bookshelf",
      "category": "Storage",
      "quantity": 1,
      "unitPriceCents": 33900,
      "discountCents": 0
    },
    {
      "sku": "SKU-SF-690",
      "title": "Otis Loveseat",
      "category": "Seating",
      "quantity": 1,
      "unitPriceCents": 89900,
      "discountCents": 1000
    },
    {
      "sku": "SKU-AP-205",
      "title": "Nimbus Floor Lamp",
      "category": "Lighting",
      "quantity": 2,
      "unitPriceCents": 15900,
      "discountCents": 1500
    },
    {
      "sku": "SKU-CH-340",
      "title": "Marlow Lounge Chair",
      "category": "Seating",
      "quantity": 1,
      "unitPriceCents": 38900,
      "discountCents": 0
    }
  ],
  "earlyOrderCarrier": "USPS",
  "lateOrderPaymentMethod": "mastercard"
}